{
 "sim_id": "SIM-R1-C4",
 "iteration": 10,
 "status": "executed",
 "started_utc": "2026-10-24T04:08:35.229780+00:00",
 "finished_utc": "2026-10-24T04:08:36.320693+00:00",
 "environment": {
  "python": "3.13.5",
  "platform": "Linux-6.12.94+-x86_64-with-glibc2.41",
  "numpy": "2.5.4",
  "scipy": "1.18.1"
 },
 "command": "python simulation/sim_r1.py simulation/iter-10",
 "params_sha256": "88d168431ca3f78df70c156918239a37a94ea0fea5d6dfc519edad37572364b5",
 "outputs": {
  "outputs/results.json": "dedba484ed1639b75df1c7d86c9b75fba919f4a294b2c11fa4741d40cd7c3258"
 },
 "pre_registered_checks": [
  {
   "id": "H10",
   "kind": "hypothesis",
   "expect": "continuous metric, a third grid with new points: >= 1 setting meets both anchors",
   "observed": [
    1,
    144
   ],
   "result": "Supported"
  }
 ],
 "n_checks": 1,
 "n_validation": 0,
 "n_validation_pass": 0,
 "n_hypothesis": 1,
 "n_supported": 1,
 "n_reporting": 0,
 "all_validation_passed": true
}
