{
 "sim_id": "SIM-R6-C2",
 "iteration": 3,
 "status": "executed",
 "started_utc": "2026-10-24T02:07:08.874604+00:00",
 "finished_utc": "2026-10-24T02:07:12.882602+00:00",
 "environment": {
  "python": "3.13.5",
  "platform": "Linux-6.12.94+-x86_64-with-glibc2.41",
  "numpy": "2.5.4",
  "scipy": "1.18.1"
 },
 "command": "python simulation/sim_r6.py simulation/iter-3",
 "params_sha256": "275ab51abc2846160b94f0fd46684e435b00b94af19c222c8dd185a2a69657a3",
 "outputs": {
  "outputs/results.json": "e8be700f82dbff0663c38c72d62bde15bfc6735d244153f4f6393be783a388a9"
 },
 "pre_registered_checks": [
  {
   "id": "RR1",
   "kind": "hypothesis",
   "expect": "W03 verbal argument: the faster adaptation is relative to forcing, the weaker the regulation (Spearman rho(adapt per forcing step, width) <= -0.8)",
   "observed": -0.3883409634,
   "result": "Not supported"
  }
 ],
 "n_checks": 1,
 "n_validation": 0,
 "n_validation_pass": 0,
 "n_hypothesis": 1,
 "n_supported": 0,
 "n_reporting": 0,
 "all_validation_passed": true
}
