{
 "sim_id": "SIM-R2-C4",
 "iteration": 7,
 "status": "executed",
 "started_utc": "2026-10-24T04:12:12.297387+00:00",
 "finished_utc": "2026-10-24T04:12:14.372847+00:00",
 "environment": {
  "python": "3.13.5",
  "platform": "Linux-6.12.94+-x86_64-with-glibc2.41",
  "numpy": "2.5.4",
  "scipy": "1.18.1"
 },
 "command": "python simulation/sim_r2.py simulation/iter-7",
 "params_sha256": "47a6598253327398089c5630eddd77d8ccd28d34ea5a7504c8ed7c9b87e5de52",
 "outputs": {
  "outputs/results.json": "6c564a37123a154afc99203387ec07eeb386e69b7ca39b800cdee8e78f0c4ee6"
 },
 "pre_registered_checks": [
  {
   "id": "H7r",
   "kind": "reporting",
   "expect": "share of 50/50 and other mixtures classified as KF (a two-model comparison forces a choice)",
   "observed": {
    "0.0": 0.0333333333,
    "0.25": 0.3833333333,
    "0.5": 0.6,
    "0.75": 0.85,
    "1.0": 0.9333333333
   },
   "result": "Reported"
  },
  {
   "id": "H7",
   "kind": "hypothesis",
   "expect": "a 50/50 PH-KF mixture is NOT confidently assigned to either model (share classified KF between 0.2 and 0.8)",
   "observed": 0.6,
   "result": "Supported"
  }
 ],
 "n_checks": 2,
 "n_validation": 0,
 "n_validation_pass": 0,
 "n_hypothesis": 1,
 "n_supported": 1,
 "n_reporting": 1,
 "all_validation_passed": true
}
